curriculum,grade,subject,topic,subtopic,question_type,question_text,options,correct_answer,difficulty,explanation,hint,solution_steps
IB,Grade 12,Biology HL,Developmental Biology (HL),Cell Differentiation & Stem Cells,MCQ,"What is cell differentiation?","[""A) The process of cell division"", ""B) The process by which cells become specialized for specific functions"", ""C) The movement of cells during development"", ""D) The death of cells during development""]",B,Easy,"Cell differentiation is the process by which unspecialized cells become specialized to perform specific functions. This occurs through selective gene expression, where different genes are activated or silenced in different cell types.","Think about what happens when a cell develops a specific function, like becoming a muscle cell or nerve cell.","1. Review the definition of differentiation\n2. Eliminate options that describe other cellular processes\n3. Identify the option that describes specialization\n4. Answer: B"
IB,Grade 12,Biology HL,Developmental Biology (HL),Cell Differentiation & Stem Cells,MCQ,"Which type of stem cell can differentiate into all body cell types but not extraembryonic tissues?","[""A) Multipotent stem cells"", ""B) Totipotent stem cells"", ""C) Pluripotent stem cells"", ""D) Unipotent stem cells""]",C,Medium,"Pluripotent stem cells can differentiate into any cell type in the body but cannot form extraembryonic tissues like the placenta. Embryonic stem cells are an example of pluripotent cells.","Consider the different levels of differentiation potential in stem cells, from most versatile to most specialized.","1. Review the hierarchy of stem cell potency\n2. Totipotent can form all tissues including extraembryonic\n3. Pluripotent can form all body tissues but not extraembryonic\n4. Answer: C"
IB,Grade 12,Biology HL,Developmental Biology (HL),Cell Differentiation & Stem Cells,MCQ,"What is the primary mechanism by which cell differentiation occurs?","[""A) Changes in DNA sequence in different cells"", ""B) Selective gene expression in different cell types"", ""C) Loss of chromosomes during development"", ""D) Random activation of genes""]",B,Medium,"Cell differentiation occurs through selective gene expression. All cells in an organism contain the same DNA, but different genes are expressed in different cell types. This allows cells to produce different proteins and therefore develop different structures and functions.","Remember that all cells in an organism have the same genetic information, so what must change to create different cell types?","1. Consider that all cells have identical DNA\n2. Eliminate options involving DNA sequence changes\n3. Recognize that gene expression patterns differ between cell types\n4. Answer: B"
IB,Grade 12,Biology HL,Developmental Biology (HL),Cell Differentiation & Stem Cells,MCQ,"Embryonic stem cells are typically derived from which developmental stage?","[""A) Morula"", ""B) Blastocyst"", ""C) Gastrula"", ""D) Zygote""]",B,Hard,"Embryonic stem cells are derived from the inner cell mass of the blastocyst, an early stage embryo (approximately $5$-$7$ days after fertilization). These cells are pluripotent and can differentiate into any cell type in the body.","Think about which early embryonic stage contains a hollow ball of cells with an inner cell mass.","1. Review the stages of early embryonic development\n2. The zygote is a single cell (not a stem cell source)\n3. The blastocyst has the inner cell mass\n4. Answer: B"
IB,Grade 12,Biology HL,Developmental Biology (HL),Cell Differentiation & Stem Cells,FillBlank,"The process by which unspecialized cells become specialized to perform specific functions is called ___.",cell differentiation,Easy,"Cell differentiation is fundamental to development, allowing a single fertilized egg to give rise to the many specialized cell types in an organism. This process is controlled by changes in gene expression.","Think of the term that describes cells becoming specialized or different from each other.","1. Consider what happens during development\n2. Cells start unspecialized and become specialized\n3. The term for becoming different or specialized\n4. Answer: cell differentiation"
IB,Grade 12,Biology HL,Developmental Biology (HL),Cell Differentiation & Stem Cells,FillBlank,"Stem cells that can differentiate into any cell type in the body including extraembryonic tissues are called ___.",totipotent,Medium,"Totipotent stem cells have the highest differentiation potential. In humans, only the zygote and cells from the first few divisions are totipotent. These cells can form both the embryo and the placenta.","Consider the hierarchy of stem cell types - which has the greatest potential to form all tissue types?","1. Review stem cell potency levels\n2. Pluripotent forms body tissues only\n3. Totipotent forms all tissues including placenta\n4. Answer: totipotent"
IB,Grade 12,Biology HL,Developmental Biology (HL),Cell Differentiation & Stem Cells,FillBlank,"Adult stem cells found in bone marrow and other tissues are typically ___ and can only differentiate into a limited range of related cell types.",multipotent,Hard,"Multipotent stem cells are found in adult tissues and can differentiate into multiple cell types, but only within a particular lineage. For example, hematopoietic stem cells in bone marrow can produce all blood cell types but cannot become nerve or muscle cells.","Think about stem cells that are more specialized than embryonic stem cells but can still produce several cell types.","1. Compare adult stem cells to embryonic stem cells\n2. Adult stem cells have more limited potential\n3. They can form multiple but related cell types\n4. Answer: multipotent"
IB,Grade 12,Biology HL,Developmental Biology (HL),Cell Differentiation & Stem Cells,FreeResponse,"Explain why stem cells are valuable for medical research and treatment, providing at least two specific examples.","Stem cells are valuable for medical research and treatment because they can differentiate into specialized cell types, offering potential therapies for diseases and injuries. First, stem cells can be used to replace damaged tissues, such as using stem cell therapy to regenerate damaged heart tissue after a heart attack or to treat spinal cord injuries. Second, stem cells provide models for studying disease development and drug testing, allowing researchers to grow diseased tissues in the laboratory to understand mechanisms and test potential treatments. Additionally, stem cells could potentially be used to grow organs for transplantation, reducing the shortage of donor organs.",Medium,"This answer addresses the regenerative potential of stem cells and their research applications. Stem cells' ability to differentiate makes them useful for replacing damaged cells and understanding disease processes in ways that traditional methods cannot achieve.","Consider both the therapeutic applications (treating diseases) and research applications (studying diseases) of stem cells.","1. Identify key properties of stem cells (differentiation ability)\n2. Connect to medical applications (tissue regeneration, disease modeling)\n3. Provide specific examples (heart tissue, spinal cord, drug testing)\n4. Explain why these applications are valuable"
IB,Grade 12,Biology HL,Developmental Biology (HL),Cell Differentiation & Stem Cells,FreeResponse,"Evaluate the ethical considerations surrounding the use of embryonic stem cells in research and therapy.","The use of embryonic stem cells raises significant ethical considerations. The primary ethical concern is that obtaining embryonic stem cells typically requires the destruction of a blastocyst, which some people consider to be a human life deserving of protection. This creates a moral conflict between the potential to save lives through stem cell therapies and the destruction of embryos. Those who support embryonic stem cell research argue that the potential benefits - treating diseases like Parkinson's, diabetes, and spinal cord injuries - outweigh concerns about early-stage embryos, especially when using excess embryos from fertility treatments that would otherwise be discarded. Opponents argue that human life begins at conception and that destroying embryos is morally wrong regardless of potential benefits. Alternative approaches, such as induced pluripotent stem cells (iPSCs), offer a potential compromise by creating pluripotent cells from adult tissues without using embryos, though these technologies are still being refined. The ethical debate must balance respect for different views on when life begins with the potential to alleviate human suffering.",Hard,"This answer evaluates multiple perspectives on embryonic stem cell ethics, including the moral status of embryos, potential therapeutic benefits, and alternative approaches. The IB curriculum expects students to understand different ethical viewpoints and consider scientific alternatives.","Consider both sides of the debate: the potential benefits of stem cell treatments and the concerns about destroying embryos.","1. Identify the main ethical issue (embryo destruction)\n2. Present arguments supporting research (medical benefits)\n3. Present arguments opposing research (moral status of embryos)\n4. Discuss alternatives (iPSCs)\n5. Conclude with balanced evaluation"
IB,Grade 12,Biology HL,Developmental Biology (HL),Cell Differentiation & Stem Cells,Match,"Match each stem cell type to its differentiation potential:\n\nStem Cell Types:\n1. Totipotent\n2. Pluripotent\n3. Multipotent\n4. Unipotent\n\nDifferentiation Potentials:\nA) Can differentiate into all cell types including embryo and extraembryonic tissues\nB) Can differentiate into only one specific cell type\nC) Can differentiate into multiple related cell types within one tissue lineage\nD) Can differentiate into all body cell types but not extraembryonic tissues","[""1-A"", ""2-D"", ""3-C"", ""4-B""]","1-A, 2-D, 3-C, 4-B",Medium,"Understanding the hierarchy of stem cell potency is essential in developmental biology. Totipotent cells (like the zygote) have the highest potential and can form all tissues. Pluripotent cells (like embryonic stem cells) can form all body tissues but not placental tissues. Multipotent cells (like adult stem cells) are more restricted to specific lineages. Unipotent cells can only produce one cell type.","Start with the stem cell type that has the most potential and work down to the least potential.","1. Totipotent = highest potential = all tissues including extraembryonic (1-A)\n2. Pluripotent = all body tissues only (2-D)\n3. Multipotent = multiple related types (3-C)\n4. Unipotent = one type only (4-B)"
IB,Grade 12,Biology HL,Developmental Biology (HL),Cell Differentiation & Stem Cells,MCQ,"Which cells in an early embryo have totipotent characteristics?","[""A) Cells in the inner cell mass of the blastocyst"", ""B) Cells in the blastocyst cavity"", ""C) The zygote and cells from the first few divisions"", ""D) Cells in the placenta only""]",C,Easy,"Totipotent cells can differentiate into any cell type including extraembryonic tissues. In humans, the zygote and cells from the first few divisions (up to the $8$-cell stage) are considered totipotent because they can form both the embryo and placental tissues.","Think about which cells in early development have the ability to form both the embryo and supporting structures like the placenta.","1. Review which cells can form all tissue types\n2. The inner cell mass is pluripotent, not totipotent\n3. Only the earliest cells are totipotent\n4. Answer: C"
IB,Grade 12,Biology HL,Developmental Biology (HL),Cell Differentiation & Stem Cells,MCQ,"What are induced pluripotent stem cells (iPSCs)?","[""A) Stem cells extracted from embryos"", ""B) Adult cells that have been reprogrammed to become pluripotent"", ""C) Stem cells found naturally in bone marrow"", ""D) Cells that have lost their ability to divide""]",B,Medium,"Induced pluripotent stem cells (iPSCs) are adult somatic cells that have been reprogrammed back to a pluripotent state by introducing specific transcription factors. This technology, developed by Shinya Yamanaka, allows creation of pluripotent cells without using embryos.","Consider the term 'induced' - what does it suggest about how these cells are created?","1. The word 'induced' suggests artificial creation\n2. iPSCs are not naturally occurring\n3. They are created by reprogramming adult cells\n4. Answer: B"
IB,Grade 12,Biology HL,Developmental Biology (HL),Cell Differentiation & Stem Cells,MCQ,"In therapeutic cloning, what is the source of the nucleus used to create the cloned embryo?","[""A) A donor egg cell"", ""B) A sperm cell"", ""C) A cell from the patient requiring treatment"", ""D) An embryonic stem cell""]",C,Medium,"In therapeutic cloning (also called somatic cell nuclear transfer), the nucleus from a patient's own cell is transferred into an enucleated egg. The resulting embryo is genetically identical to the patient, allowing stem cells to be harvested that will not be rejected by the patient's immune system.","Think about why this technique is called 'therapeutic' and how it could help avoid immune rejection.","1. Therapeutic cloning aims to create patient-matched cells\n2. The nucleus must come from the patient for genetic matching\n3. This prevents immune rejection\n4. Answer: C"
IB,Grade 12,Biology HL,Developmental Biology (HL),Cell Differentiation & Stem Cells,MCQ,"Which factor is NOT typically involved in maintaining stem cell properties in an undifferentiated state?","[""A) Specific transcription factors that maintain pluripotency"", ""B) Signals from the surrounding stem cell niche"", ""C) Accumulation of DNA mutations"", ""D) Cell-to-cell signaling molecules""]",C,Hard,"Stem cells are maintained in an undifferentiated state through transcription factors, signals from the stem cell niche, and cell-to-cell signaling. Accumulation of DNA mutations would typically be harmful and is not a mechanism for maintaining stem cell properties. In fact, stem cells have enhanced DNA repair mechanisms to prevent mutations.","Consider which option describes something potentially harmful rather than a regulatory mechanism.","1. Review normal stem cell regulation mechanisms\n2. Transcription factors, niche signals, and cell signaling are regulatory\n3. Mutations are damage, not regulation\n4. Answer: C"
IB,Grade 12,Biology HL,Developmental Biology (HL),Cell Differentiation & Stem Cells,FillBlank,"Stem cells that produce red blood cells, white blood cells, and platelets are found in the ___.",bone marrow,Easy,"Bone marrow contains hematopoietic stem cells, which are multipotent adult stem cells that can differentiate into all types of blood cells. Bone marrow transplants are used to treat blood disorders like leukemia.","Think about where blood cells are produced in the adult body.","1. Consider where blood cell formation occurs\n2. This process is called hematopoiesis\n3. It occurs in a specific tissue inside bones\n4. Answer: bone marrow"
IB,Grade 12,Biology HL,Developmental Biology (HL),Cell Differentiation & Stem Cells,FillBlank,"The local microenvironment that maintains stem cells in an undifferentiated state is called the stem cell ___.",niche,Medium,"The stem cell niche is the specific microenvironment where stem cells reside. It provides physical support and biochemical signals that maintain stem cells in an undifferentiated state and regulate when they divide or differentiate.","Think about the term used in ecology for a specific role or position - a similar term is used for the stem cell environment.","1. Stem cells need a supportive environment\n2. This environment provides regulatory signals\n3. The term is borrowed from ecology\n4. Answer: niche"
IB,Grade 12,Biology HL,Developmental Biology (HL),Cell Differentiation & Stem Cells,FillBlank,"Adult somatic cells can be reprogrammed to become pluripotent by introducing specific ___ factors that control gene expression.",transcription,Hard,"Induced pluripotent stem cells (iPSCs) are created by introducing specific transcription factors (such as Oct4, Sox2, Klf4, and c-Myc) into adult cells. These transcription factors reprogram the cell's gene expression pattern to resemble that of embryonic stem cells, restoring pluripotency.","Think about the type of protein that regulates gene expression by binding to DNA.","1. Consider what regulates gene expression\n2. These proteins bind to DNA to control genes\n3. They are called transcription factors\n4. Answer: transcription"
IB,Grade 12,Biology HL,Developmental Biology (HL),Cell Differentiation & Stem Cells,FreeResponse,"Compare embryonic stem cells and adult stem cells in terms of their differentiation potential, sources, and ethical considerations.","Embryonic stem cells and adult stem cells differ in several important ways. First, in terms of differentiation potential, embryonic stem cells are pluripotent and can differentiate into any cell type in the body, while adult stem cells are typically multipotent and can only differentiate into a limited range of cell types related to their tissue of origin. Second, regarding sources, embryonic stem cells are derived from the inner cell mass of blastocysts (early embryos), whereas adult stem cells are found in various tissues throughout the body, such as bone marrow, skin, and intestinal lining. Third, concerning ethical considerations, embryonic stem cells raise ethical concerns because obtaining them requires destruction of an embryo, which some consider morally problematic. Adult stem cells do not raise these same ethical concerns because they can be obtained from living donors without destroying embryos. However, embryonic stem cells have greater therapeutic potential due to their higher differentiation capacity, making the ethical debate complex.",Medium,"This answer provides a comprehensive comparison across multiple dimensions. Understanding the differences between stem cell types is essential for evaluating their applications in medicine and research, as well as understanding the ethical debates surrounding stem cell use.","Consider the key differences in what these cells can do, where they come from, and the ethical issues each type raises.","1. Compare differentiation potential (pluripotent vs multipotent)\n2. Compare sources (blastocyst vs adult tissues)\n3. Compare ethical issues (embryo destruction vs no embryos)\n4. Explain the relationship between potential and ethics"
IB,Grade 12,Biology HL,Developmental Biology (HL),Cell Differentiation & Stem Cells,FreeResponse,"Explain how induced pluripotent stem cells (iPSCs) address some of the ethical concerns associated with embryonic stem cells while maintaining therapeutic potential.","Induced pluripotent stem cells (iPSCs) address ethical concerns while maintaining therapeutic potential through several key features. First, iPSCs are created by reprogramming adult somatic cells (such as skin cells) to a pluripotent state by introducing specific transcription factors. This means no embryos are destroyed in the process, eliminating the primary ethical objection to embryonic stem cell research. Second, like embryonic stem cells, iPSCs are pluripotent and can differentiate into any cell type in the body, maintaining the same therapeutic potential for treating diseases and injuries. Third, iPSCs can be created from a patient's own cells, making them genetically identical to the patient and eliminating the risk of immune rejection - an advantage over both embryonic stem cells and donor tissues. However, iPSC technology is still being refined, as there are concerns about the complete reprogramming of cells and potential risks such as tumor formation. Despite these challenges, iPSCs represent a promising compromise that addresses ethical objections while preserving the therapeutic benefits of pluripotent stem cells.",Hard,"This answer demonstrates understanding of both the technical and ethical dimensions of stem cell research. iPSCs represent an important scientific advancement that addresses societal concerns while maintaining research and therapeutic applications - a key concept in modern bioethics.","Consider how creating pluripotent cells from adult cells solves the embryo destruction problem while keeping the benefits.","1. Explain what iPSCs are (reprogrammed adult cells)\n2. Identify the ethical advantage (no embryo destruction)\n3. Explain maintained therapeutic potential (pluripotency)\n4. Mention additional benefits (patient-specific)\n5. Acknowledge remaining challenges (refinement needed)"
IB,Grade 12,Biology HL,Developmental Biology (HL),Cell Differentiation & Stem Cells,Match,"Match each stem cell application to its description:\n\nApplications:\n1. Bone marrow transplant\n2. Growing replacement tissues\n3. Drug testing and disease modeling\n4. Therapeutic cloning\n\nDescriptions:\nA) Using stem cells to test how drugs affect specific cell types in the laboratory\nB) Transplanting hematopoietic stem cells to treat blood cancers and disorders\nC) Creating patient-specific stem cells through somatic cell nuclear transfer\nD) Using stem cells to generate tissues or organs for transplantation","[""1-B"", ""2-D"", ""3-A"", ""4-C""]","1-B, 2-D, 3-A, 4-C",Medium,"Understanding stem cell applications is crucial for appreciating their medical value. Bone marrow transplants use naturally occurring adult stem cells and are an established treatment. Growing replacement tissues is a developing application of stem cell differentiation. Drug testing uses stem cells to model diseases without human testing. Therapeutic cloning creates genetically matched cells to avoid immune rejection.","Match established treatments with adult stem cells, and more experimental applications with pluripotent stem cell technologies.","1. Bone marrow transplant = established blood cell treatment (1-B)\n2. Growing tissues = differentiation application (2-D)\n3. Drug testing = laboratory research use (3-A)\n4. Therapeutic cloning = patient-specific cells (4-C)"
IB,Grade 12,Biology HL,Developmental Biology (HL),Cell Differentiation & Stem Cells,MCQ,"Which of the following is an example of cell differentiation?","[""A) A skin cell dividing to produce two identical skin cells"", ""B) A zygote developing through early cleavage divisions"", ""C) An unspecialized embryonic cell becoming a specialized nerve cell"", ""D) A cell undergoing programmed cell death""]",C,Easy,"Cell differentiation is the process by which an unspecialized cell becomes a specialized cell with a specific structure and function. An embryonic cell becoming a nerve cell is a clear example of differentiation, as the cell acquires specialized features like axons and dendrites.","Look for the option where a cell is changing from unspecialized to specialized, not just dividing or dying.","1. Review the definition of differentiation (specialization)\n2. Eliminate cell division (produces identical cells)\n3. Eliminate cell death (not differentiation)\n4. Answer: C"
IB,Grade 12,Biology HL,Developmental Biology (HL),Cell Differentiation & Stem Cells,MCQ,"What is one advantage of using adult stem cells compared to embryonic stem cells for medical treatments?","[""A) Adult stem cells are pluripotent like embryonic stem cells"", ""B) Adult stem cells do not raise ethical concerns about embryo destruction"", ""C) Adult stem cells can differentiate into more cell types than embryonic stem cells"", ""D) Adult stem cells divide more rapidly than embryonic stem cells""]",B,Medium,"Adult stem cells have the advantage of not requiring embryo destruction, which addresses the main ethical concern with embryonic stem cell research. However, adult stem cells are multipotent (not pluripotent) and have more limited differentiation potential than embryonic stem cells.","Consider the ethical debates surrounding different stem cell sources.","1. Review ethical concerns with embryonic stem cells\n2. Adult stem cells come from living donors\n3. No embryos are destroyed for adult stem cells\n4. Answer: B"
IB,Grade 12,Biology HL,Developmental Biology (HL),Cell Differentiation & Stem Cells,FillBlank,"The process of creating genetically identical embryos through nuclear transfer to obtain patient-specific stem cells is called ___ cloning.",therapeutic,Medium,"Therapeutic cloning (also known as somatic cell nuclear transfer for therapeutic purposes) involves creating a cloned embryo from a patient's cell to obtain stem cells that are genetically matched to the patient. This is distinct from reproductive cloning, which aims to create a complete organism.","Think about what this type of cloning is used for - therapy or research, not creating a whole organism.","1. Consider the purpose of this cloning\n2. It's used for medical treatment\n3. Not for creating whole organisms (reproductive)\n4. Answer: therapeutic"
IB,Grade 12,Biology HL,Developmental Biology (HL),Cell Differentiation & Stem Cells,FillBlank,"Once a cell has differentiated into a specialized type, this process is generally considered ___, although it can be reversed through reprogramming techniques like creating iPSCs.",irreversible,Hard,"Cell differentiation was traditionally considered irreversible because differentiated cells maintain their specialized state through stable gene expression patterns. However, the discovery of induced pluripotent stem cells (iPSCs) showed that differentiation can be reversed by introducing specific transcription factors, though this requires deliberate intervention.","Under normal circumstances, can a specialized nerve cell spontaneously become a muscle cell?","1. Consider if differentiated cells normally change type\n2. Under natural conditions, specialization is permanent\n3. Requires artificial intervention to reverse\n4. Answer: irreversible"
